Repo,Issue-no,Issue-title,Issue-body,Issue-reaction-total-count,Issue-reaction-plus-one,Issue-reaction-minus-one,Issue-comments
andmorefine/since-co,787,"Invest $ 15,000 in affiliate marketing and get $ 45,000 in a month","Invest $ 15,000 in affiliate marketing and get $ 45,000 in a month 
Hey. 
Yes, you heard right. 
You don't have to do anything. 
We will do all the work for you. 
You only need to invest and wait one month to receive payments. 
https:  blockchain.com btc payment_request?address=18gaWYjABVFJ9PhG1hCqjh5FjWBrkQVuwD&amount=1.14&message=invest_in_affiliate_marketing_at_300%_per_month 
We have been engaged in affiliate marketing for many years and decided to attract investments to work in the development of three more areas of our activity. 
 
You can only invest one amount because this is the best option for earning super profits in affiliate marketing. 
We give a 100% guarantee that you will receive your profit on time. 
https:  blockchain.com btc payment_request?address=18gaWYjABVFJ9PhG1hCqjh5FjWBrkQVuwD&amount=1.14&message=invest_in_affiliate_marketing_at_300%_per_month 
After you make an investment by clicking on the link, exactly in a month your profit in the amount of 300% will be returned to your wallet from which you made the transfer to our system. 
 
The payment is made in one time. 
If you want to receive such a profit every month, then you need to invest every month. 
https:  blockchain.com btc payment_request?address=18gaWYjABVFJ9PhG1hCqjh5FjWBrkQVuwD&amount=1.14&message=invest_in_affiliate_marketing_at_300%_per_month 
There are almost two months left before the New Year, during which time you will have time to invest twice and get $ 75,000 in net profit.",0,0,0,0
andmorefine/since-co,786,Regarding andmorefine.com,"Hello 
 
Buy all styles of Oakley Sunglasses only 19.99 dollars.  If interested, please visit our site: designeroutlets.online
 
 
Kind Regards, 
 
お問い合わせ | andmorefine",0,0,0,0
andmorefine/since-co,785,Re: Trying to reach you.,"Dear Friend, 
I hope this message does not end up in spam. 
Good day to you and I hope you are keeping safe from COVID-19 Pandemic.  My name is Helina Amira Khanum, daughter of H.E. (Sahib us-Sa'ada) married to Prince Sa'Id in Saudi Arabia. I got your contact from a reliable source as someone whom I can trust. 
 
As a woman in the Kingdom, I am not allowed to do business or operate investment ventures business as a house wife. 
 
I seek individuals or companies outside the kingdom of Saudi on ground presence and experience in business that can assist me receive my money (Huge Amount) and invest them in profitable ventures while I plan for migration. 
 
I will like to keep this brief until I hear from you, you can reach me on amira@saudiroyalfamily.live. Tel: 441235330058 
 
Have a nice day, 
Madam Amira Khanum Al-Saud",0,0,0,0
andmorefine/since-co,784,Black Lives Matter - Donate,"Black Lives Matter - Donate 
Why We Need Your Support 
As our ecosystem grows our financial support system must grow as well. 
We need funds to continue our radically accessible commitment to providing healthy food from Black owned businesses, paid childcare at every event and having ASL interpreters at our monthly gatherings. 
On average, our monthly open houses attract 3000+ people and costs us $100,000. 
We need to raise $ 350,000 by November 3 to help thousands of black people in a very bad situation right now, we will be glad if you support us. 
For quick payment, we use bitcoin wallets. You can transfer donation to this Bitcoin wallet - 12B6eCHqPVQeR8wyTTMoWQqNeTpxqeq7wk 
Secondly, we need resources to make sure we have the emotional and spiritual capacity to show up and move forward in the movement as our highest selves. 
Supporting the work of our healers including renting space weekly for Black people to process racial stress through group discussion, dance, and visual art and 
affirming our humanity & love for each other by starting our week with joy via #BlackJoySunday (all while creating accessibility by offering free childcare) 
is essential in sustaining our well-being and activism. Our weekly healing spaces cost on average $30,150 month. 
We need to raise $ 350,000 by November 3 to help thousands of black people in a very bad situation right now, we will be glad if you support us. 
For quick payment, we use bitcoin wallets. You can transfer donation to this Bitcoin wallet - 12B6eCHqPVQeR8wyTTMoWQqNeTpxqeq7wk 
Lastly and most importantly, we need funds to support the emerging leadership of our ecosystem move through the world. 
As Black people in a city facing the ravages of displacement and economic disinvestment, it’s difficult to do the work of liberating your community while figuring out how to pay rent and feed yourself. 
We need your help to ensure that lack of gas money or health insurance doesn’t stop the work from moving forward. Supporting our emerging leadership, including our rapid response, 
organized resistance, healing and logistics teams, reimbursements and stipends costs on average $20,700 month.",0,0,0,0
andmorefine/since-co,783,Max Lantz,"Do you want more people to visit your website? Receive tons of keyword targeted visitors directly to your site. Boost revenues fast. Start seeing results in as little as 48 hours. To get info Have a look at: http:  bit.ly buy-more-website-visitors
",0,0,0,0
andmorefine/since-co,782,Strategic partnership,"Dear CEO andmorefine.com 
We will be most delighted in partnering with you with an intention to 
maintain a Silent Financial Position. We can provide Capital injection 
for the advancement of any viable capital project in which you require funding for. 
Our goal and mission are to be a strategic financial partner to your company as 
We look forward to a prospective confidential financial business relationship. 
For more information reply back to Email:   Mohamhassan.AlBashir@gmail.com 
Looking forward to hearing from you. 
 
Regards 
Mohammed Hassan Al-Bashir",0,0,0,0
andmorefine/since-co,781,Google MAP情報を使い企業情報を集めます。,"突然のメッセージ失礼します。 
 
表題のようにGoogle MAPを使いお客様がご希望されるターゲット(職種)リストを収集して 
収集したターゲットに対して、メッセージをお送りするサービスでございます。 
 
【全国・全世界のリスト・メール送信が可能】 
日本では最大3500万件のリストが取得できます。 
 
【リストが新鮮】 
私共はリストを持っていません。 
ご注文があった時点で各企業のWEBサイトからの情報を取得します。 
ですのでリストは常に最新です。 
 
【地域を絞れる】 
都道府県単位ではなく「市町村」更にはそれ以下の地域も絞って営業が可能 
 
類似するサービスはあるかと思いますが 
地域・業種を絞れ・最新のリストを提供できるのは世界でも私共のみです。 
地域を絞り営業を行いたい会社様必見でございます！ 
 
詳しい詳細はこちら(WEBサイトへ移動します) 
https:  is.gd 7OvS8h 
 
 
双葉サービス 
 
――― 
配信停止の場合は下記のURLで停止をお願い致します。 
必ず配信を受けたURLを記載ください。 
※自動でURLを収集して配信停止リストに載せます。 
https:  broccoli.pw stop",0,0,0,0
andmorefine/since-co,780,EINNAHMEN IM INTERNET VOR 5048 EURO PRO TAG - IN EINEM MONAT KONNEN SIE SICH EINE TEURE WOHNUNG KAUFEN: https:  ecuadortenisclub.com 3e85u,PASSIVES EINKOMMEN IM INTERNET VOR 7068 EUR IN DER WOCHE - IN EINEM MONAT KONNEN SIE SICH EIN TEURES HAUS KAUFEN: http:  gongpo.moum.kr xQYz,0,0,0,0
andmorefine/since-co,779,Admin andmorefine.com,"Hello there 
 
Buy all styles of Ray-Ban Sunglasses only 19.99 dollars.  If interested, please visit our site: framesoutlet.online
 
To your success, 
 
お問い合わせ | andmorefine",0,0,0,0
andmorefine/since-co,778,最新３Ｄも対応可！初期費用無料！定額制ホームページ制作のご案内,"建築・リフォーム関係の企業様へ 
 
突然のメッセージ、大変失礼します。 
 
こんなお悩みありませんか？ 
 
・かなり前にホームページを制作したが全然更新していない 
・ホームページからの集客を増やしたい 
・ホームページのリニューアルを検討している 
・モデルハウスを持っていないがホームページ上でモデルハウスをヴァーチャルで見せたい 
・施工例や作品例をホームページ上で高性能ＣＡＤを使い表現したい 
 
そんなご要望にお応えします。 
 
私たちの強みは、長年建築業の実務を経験している事。 
住宅営業２０年、大工経験１０年、現場監督１５年。 
そんな経歴のスタッフが、建築業にとって本当に必要だと思うホームページを 
初期費用なしの定額制で制作します。 
 
完成して終わりではなく、定期的に訪問させて頂き、 
アクセス解析をしながらお客様と共に 
集客できるホームページを作り上げていきます。 
 
ホームページ制作だけにとらわれず、 
高性能ＣＡＤによる３Ｄパース制作サービスも行っており、 
施工例や作品例の写真などが無い会社様でも図面を 
パース化しホームページ上に掲載したり、 
打合せに使用したりする事ができます。 
 
一般的なホームページ制作会社には無い、 
３Ｄパース制作サービスをご提供することにより、 
出来上がったホームページは競合他社との差別化が図れます。 
また、制作した３Ｄパースは会社の財産として、長年お使い頂けます。 
 
この機会にご検討されませんか？ 
 
詳しくはこちら 
https:  info-winwork.com winworklp 
 
まずはお気軽にご相談ください。",0,0,0,0
andmorefine/since-co,777,"EINNAHMEN IM INTERNET VON 3845 EURO AM TAG - DIE BESTE SEITE, UM ONLINE GELD ZU VERDIENEN: http:  xsle.net 3gjxn","PASSIVES EINKOMMEN IM INTERNET VON 7846 EUR PRO TAG - INNERHALB EINER WOCHE SIND SIE FINANZIELL UNABHANGIG: https:  links.wtf Gw41 
ONLINE VERDIENEN VON 3855 EUR AM TAG - INNERHALB EINER WOCHE SIND SIE FINANZIELL UNABHANGIG: https:  shorturl.ac 6tlax 
PASSIVES EINKOMMEN ONLINE VON 5066 EUR PRO TAG - KEINE BERUFSERFAHRUNG: https:  jtbtigers.com 3e6ue 
PASSIVES EINKOMMEN ONLINE VON 6975 EURO IN DER WOCHE - DIE BESTE SEITE, UM ONLINE GELD ZU VERDIENEN: https:  gmy.su :Fwfub 
PASSIVES EINKOMMEN IM INTERNET VON 9956 EURO PRO TAG - IN EINEM MONAT KONNEN SIE SICH EIN TEURES HAUS KAUFEN: http:  asq.kr OfJNaxbNLh4e",0,0,0,0
andmorefine/since-co,776,水道設備工事を直接施工業者に依頼するのは本当に「得」なのか？,"突然のご連絡申し訳ございません。 
埼玉県新座市でマンション・ビルの水道設備工事を行っております 
株式会社サンコウ設備と申します。 
 
弊社では中間を省くことで円滑なコミュニケーション+コストダウンが実現 
つまりご予算内で、2つしかできない工事が3つできます。 
 
マンションやビル設備の更新工事は新設工事と比べると。工事企画から見積り、施工と 
なかなか予定通りには行かないものです。 
それは図面と現場が違う、劣化が思ったより進んでいるなど工事を 
始めてわからないことが多く、それがコストと直結した問題になるケースが多いからに 
他なりません。 
 
 
従来の流れでは管理組合・ビルオーナー様の間には管理会社や設計管理業社、施工業社が 
間に入り中間マージンや円滑なコミュニケーションができない等の問題がございます。 
そこでサンコウ設備では工事そのものを円滑に進行させ、オーナー様と直接契約を結び、 
企画から見積り、施工まで行うサービスでございます。 
 
水道設備工事に関してお客様と知識共有できればと考えており 
まずはWEBサイトをご覧頂きまして実際の事例・ご説明をご覧頂けれと思います。 
https:  www.sankou-setsubi.co.jp  
 
 
 
株式会社サンコウ設備 
埼玉県新座市池田2-6-20 
https:  www.sankou-setsubi.co.jp ",0,0,0,0
andmorefine/since-co,775,極秘！あなたのYoutube動画を一斉に10万人に知ってもらえます,"突然のメッセージ 
大変失礼いたします。 
 
Youtube動画の認知度を爆上げする 
極秘サービスのご案内です。 
 
 
このような課題でお困りではありませんか？ 
・YouTubeの再生回数が増えない 
・もっとたくさんの人に動画を見てもらいたい 
・再生回数を増やして説得力を持たせたい 
 
 
我々は「一斉に最大10万人に認知」 
させることが可能です。 
 
また、再生回数保証型なので安心です。 
 
詳しくはこちらをご覧ください。 
https:  www.peppers.company youtubeマーケティング 
 
 
最後までご覧いただき 
感謝申し上げます。",0,0,0,0
andmorefine/since-co,774,"AIが10万件の企業・事業主様に営業致します「30,000円」","突然のメッセージを致したことを先にお詫び致します。 
弊社のサービスはお客様に変わって全国10万件以上の事業主様に 
AIが営業代行を行うサービスを提供しております。 
海外も含めると1600万件の事業主様に営業することがが可能 
 
詳しくはこちらのページをご覧下さい。 
https:  rb.gy x9ukty 
 
 
最後に・・・ 
色々な営業手段がWEBサイトにはあると思います。 
有名なのはGoogle AdWordsだったり。 
1件のアポ・契約を取るための費用(コスト)を考えたことはございますか? 
調べてみると意外と1件につき12,000円以上の場合が多くございます。 
是非!私共のサービスと比較して頂きたいと考えております。 
 
 
━━━━━━━━━━━━━━━━━━━━━━━━━━━━━━━━━━━━━ 
＊発信者名：SSA 
※配信がご不要の方は、誠にお手数ですが【配信を受けたURL】を 
下記のURLに記載の上ご返信ください。 
https:  bit.ly 3faYYg4",0,0,0,0
andmorefine/since-co,773,Britt Kemp,Advertise your site FREE here!: http:  bit.ly post-your-ad-free,0,0,0,0
andmorefine/since-co,772,クオリティの高いホームページ制作が低額で依頼し放題！,"ご担当者様 
 
チームＤの加藤と申します。 
 
御社のホームページを拝見し 
一緒に協業できないかと思い、ご連絡させていただきました。 
 
 
弊社のチームＤは、 
 
・クオリティの高いホームページ制作が依頼し放題！ 
・低額のサブスクリプション！ 
・デザインだけでなく、ディレクションも依頼し放題！ 
 
という業界初の新しいサービスです。 
 
https:  www.t-time1500.com teamd index.html 
 
 
ホームページは常に追加・更新が必要とされますが 
その都度、業者様に依頼して見積や大幅な改善をお願いして 
高い支払いをするのは大きな出費です。 
 
 
弊社では月額６万５０００円で 
デザイン依頼し放題で、何度でも修正可能な安心なサービスです。 
低額・割安で高いクオリティを維持できます。 
 
※コロナ禍で、デザイナーを雇えない！ 
外注だと高額だ！とお考えの企業様にぴったりなサービスです。 
 
 
今回、このメッセージからお問い合わせいただいた方には 
 
毎月限定５社 
非公開の特別価格をご用意しております。 
~~~~~~~~~~~~~~~~~~ 
 
もしご興味がございましたら、 
以下のメールにご返信をお願いいたします。 
 
teamd1500@gmail.com 
 
 
-------------------------- 
(株)Ｔ-ＴＩＭＥ 
定額デザイン＆ディレクション依頼し放題 
チームＤ 
https:  www.t-time1500.com teamd index.html 
 
担当：加藤 
teamd1500@gmail.com",0,0,0,0
andmorefine/since-co,771,自動でレビューが増え、売上2倍を実現するサービスをご存知ですか？,"「良いレビューを増やしたい」とお考えの経営者様へ 
 
 
お世話になります。 
 
インターネット上の「レビュー」が 
売上に大きな影響を与えている 
ということをご存知でしょうか？ 
 
実際に「レビュー施策」として 
色々な事に取り組んでいらっしゃる 
企業や店舗様も多いことと思います。 
 
しかし 
・思うようにレビューが入らない 
・悪い口コミが入ってしまった 
・どのような取り組みをしたら良いのかわからない 
 
このようなお悩みはないでしょうか？ 
 
我々は、御社が何もする事なく 
「自動で」良いレビューを増やす 
サービスをご提供しています。 
 
良いレビューが増えると 
集客UP・企業イメージUP・売上UP 
と全てが良い循環へと様変わりします。 
 
成功事例などこちらをご確認ください。 
https:  www.service-menu.site レビュー増えるくん 
 
無料相談を受け付けておりますので 
この機会にインターネット上の状態を 
改善しませんか？ 
 
ご一読、ありがとうございました。",0,0,0,0
andmorefine/since-co,770,PASSIVES EINKOMMEN VON 5875 EURO AM TAG - GONNEN SIE SICH FINANZIELLE FREIHEIT: http:  freeurlredirect.com 3jsq0,"PASSIVES EINKOMMEN VON 4856 EUR IN DER WOCHE - DER BESTE WEG, UM ONLINE GELD ZU VERDIENEN: https:  darknesstr.com 3dyz4 
PASSIVES EINKOMMEN ONLINE VOR 7067 EUR IN DER WOCHE - DIE BESTE INVESTITIONSMOGLICHKEIT: https:  darknesstr.com 3e144 
PASSIVES EINKOMMEN IM INTERNET VON 4755 EURO IN DER WOCHE - IN EINEM MONAT KONNEN SIE IHREN JOB SICHER KUNDIGEN: https:  gmy.su :9Ibub 
PASSIVES EINKOMMEN VON 4056 EURO AM TAG - KEINE BERUFSERFAHRUNG: http:  wunkit.com Z=AjAA 
ONLINE VERDIENEN VOR 4856 EURO IN DER WOCHE - IN EINEM MONAT KONNEN SIE IHREN JOB SICHER KUNDIGEN: http:  wunkit.com evcjAA",0,0,0,0
andmorefine/since-co,769,【仮名:Instagramでターゲットが狙えるサービス】,"Instagramをうまく利用していますでしょうか？ 
一昨年前は自動化(自動でいいね!フォロー等)が人気でしたが 
現在はインスタ側からのアカウント停止などがあり過去のサービスとなりました。 
 
今現在は？といえば・・・ 
実は特に大きなサービスというものは存在しません。 
そこで私共が考えたシンプルで驚異的なサービスを考えました！ 
ターゲット情報を収集してリスト化(ターゲットのアカウント収集) 
アカウント名に対してDM(メッセージ)を送信します。 
送信に利用するアカウントについては、こちらが用意したアカウントを使いますので 
お客様のアカウントを利用することはありません。 
 
ターゲット: 
ハッシュタグ・地域などのセグメントを選択 
 
お客様のアカウントを利用しない理由: 
利用制限などの問題発生を回避するため 
 
実際の利用例: 
東京都渋谷区の飲食店の場合 
 
↓ターゲット↓ 
<>#20301;置情報] 東京都渋谷区 渋谷周辺の区 
<>#12495;ッシュタグ] #渋谷グルメ #渋谷 ...等 
 
ご希望であれば送信したアカウント情報(誰に送ったか？)を 
お出し致しますので添付した情報を見れば相手先(ターゲット)の情報が 
記載されていますのでリストの再利用も可能でございます。 
 
「仮名:Instagramでターゲットが狙えるサービス」については 
完成したばかりですのでWEBサイトでのPR、広告・宣伝等は一切しておらず 
これから開始は致しますが、余り大きく広げるようなサービスではありませんので 
まずはお知らせということでご連絡を致しました。 
 
その他、Instagramのフォロワー、いいね!増加サービス 
YouTube再生回数増加などのサービスも行っております。 
 
https:  underground-jp.com  
 
【代理店も募集】 
その他、代理店も募集をしておりご興味があれば直接連絡を頂ければと思います。 
資料は特にご用意しておりません。 
個々のサービス希望に合わせてカスタマイズしていきたいと思っておりますので 
お客様のご希望などを書いて頂ければと思います。 
 
ご興味があれば下記のメールアドレスにご連絡下さい。 
 
連絡先: 
snstokyo365@gmail.com",0,0,0,0
andmorefine/since-co,768,cheap monthly SEO plans,"Hi! 
I have just checked andmorefine.com for the ranking keywords and seen that your SEO metrics could use a boost. 
 
We will improve your SEO metrics and ranks organically and safely, using only whitehat methods, while providing monthly reports and outstanding support. 
 
Please check our pricelist here, we offer SEO at cheap rates. 
https:  www.hilkom-digital.de cheap-seo-packages  
 
Start increasing your sales and leads with us, today! 
 
regards 
Hilkom Digital Team 
support@hilkom-digital.de",0,0,0,0
andmorefine/since-co,767,Marilyn Tackett,"Do you want to promote your business on 1000's of Advertising sites every month? Pay one low monthly fee and get almost endless traffic to your site forever!

Get more info by visiting: http:  www.permanent-web-links.xyz",0,0,0,0
andmorefine/since-co,766,Eric Jones,"Hey, my name’s Eric and for just a second, imagine this…

- Someone does a search and winds up at andmorefine.com.

- They hang out for a minute to check it out.  “I’m interested… but… maybe…”

- And then they hit the back button and check out the other search results instead. 

- Bottom line – you got an eyeball, but nothing else to show for it.

- There they go.

This isn’t really your fault – it happens a LOT – studies show 7 out of 10 visitors to any site disappear without leaving a trace.

But you CAN fix that.

Talk With Web Visitor is a software widget that’s works on your site, ready to capture any visitor’s Name, Email address and Phone Number.  It lets you know right then and there – enabling you to call that lead while they’re literally looking over your site.

CLICK HERE http:  www.talkwithwebvisitors.com to try out a Live Demo with Talk With Web Visitor now to see exactly how it works.

Time is money when it comes to connecting with leads – the difference between contacting someone within 5 minutes versus 30 minutes later can be huge – like 100 times better!

Plus, now that you have their phone number, with our new SMS Text With Lead feature you can automatically start a text (SMS) conversation… so even if you don’t close a deal then, you can follow up with text messages for new offers, content links, even just “how you doing?” notes to build a relationship.

Strong stuff.

CLICK HERE http:  www.talkwithwebvisitors.com to discover what Talk With Web Visitor can do for your business.

You could be converting up to 100X more leads today!

Eric
PS: Talk With Web Visitor offers a FREE 14 days trial – and it even includes International Long Distance Calling. 
You have customers waiting to talk with you right now… don’t keep them waiting. 
CLICK HERE http:  www.talkwithwebvisitors.com to try Talk With Web Visitor now.

If you'd like to unsubscribe click here http:  talkwithwebvisitors.com unsubscribe.aspx?d=andmorefine.com
",0,0,0,0
andmorefine/since-co,765,OH2TS,body,0,0,0,0
