Repo,Issue-no,Issue-title,Issue-body,Issue-reaction-total-count,Issue-reaction-plus-one,Issue-reaction-minus-one,Issue-comments
andmorefine/since-co,1067,Eric Jones,"Hey there, I just found your site, quick question…

My name’s Eric, I found andmorefine.com after doing a quick search – you showed up near the top of the rankings, so whatever you’re doing for SEO, looks like it’s working well.

So here’s my question – what happens AFTER someone lands on your site?  Anything?

Research tells us at least 70% of the people who find your site, after a quick once-over, they disappear… forever.

That means that all the work and effort you put into getting them to show up, goes down the tubes.

Why would you want all that good work – and the great site you’ve built – go to waste?

Because the odds are they’ll just skip over calling or even grabbing their phone, leaving you high and dry.

But here’s a thought… what if you could make it super-simple for someone to raise their hand, say, “okay, let’s talk” without requiring them to even pull their cell phone from their pocket?
  
You can – thanks to revolutionary new software that can literally make that first call happen NOW.

Talk With Web Visitor is a software widget that sits on your site, ready and waiting to capture any visitor’s Name, Email address and Phone Number.  It lets you know IMMEDIATELY – so that you can talk to that lead while they’re still there at your site.
  
You know, strike when the iron’s hot!

CLICK HERE https:  talkwithwebvisitors.com to try out a Live Demo with Talk With Web Visitor now to see exactly how it works.

When targeting leads, you HAVE to act fast – the difference between contacting someone within 5 minutes versus 30 minutes later is huge – like 100 times better!

That’s why you should check out our new SMS Text With Lead feature as well… once you’ve captured the phone number of the website visitor, you can automatically kick off a text message (SMS) conversation with them. 
 
Imagine how powerful this could be – even if they don’t take you up on your offer immediately, you can stay in touch with them using text messages to make new offers, provide links to great content, and build your credibility.

Just this alone could be a game changer to make your website even more effective.

Strike when  the iron’s hot!

CLICK HERE https:  talkwithwebvisitors.com to learn more about everything Talk With Web Visitor can do for your business – you’ll be amazed.

Thanks and keep up the great work!

Eric
PS: Talk With Web Visitor offers a FREE 14 days trial – you could be converting up to 100x more leads immediately!   
It even includes International Long Distance Calling. 
Stop wasting money chasing eyeballs that don’t turn into paying customers. 
CLICK HERE https:  talkwithwebvisitors.com to try Talk With Web Visitor now.

If you'd like to unsubscribe click here http:  talkwithwebvisitors.com unsubscribe.aspx?d=andmorefine.com
",0,0,0,0
andmorefine/since-co,1066,SEO Content Writing Team,"Hi! 
 
Do you struggle to find time to write articles? 
 
Hire the best team of writing online today! 
We do all the research and provide well-written SEO content perfect for higher ranking and better visitor engagement. 
 
If you need fresh articles for your blog or content marketing strategies, check out our current content specials here: 
 
https:  writingbybenjamin.com best-seo-articles  
 
We also offer product review writing here: 
 
https:  writingbybenjamin.com review-style-articles  
 
You can also contact me directly at WBB@writingbybenjamin.com",0,0,0,0
andmorefine/since-co,1065,Likes and followers for you,"Looking for Facebook likes or Instagram followers? 
We can help you. Please visit https:  1000-likes.com  to place your order.",0,0,0,0
andmorefine/since-co,1064,Lesli Mooring,"Need extra income?

A fully hosted, done for you content + monetisation and a stunning design web based software that creates a fully automated done for you cryptocurrency affiliate site,

Visit us: https:  warriorplus.com o2 a f5s4y 0",0,0,0,0
andmorefine/since-co,1063,お問い合わせ | andmorefine,"Morning 
 
Defrost frozen foods in minutes safely and naturally with our THAW KING™. 

50% OFF for the next 24 Hours ONLY + FREE Worldwide Shipping for a LIMITED time

Buy now: thawking.online
 
Cheers, 
 
Brendan
お問い合わせ | andmorefine",0,0,0,0
andmorefine/since-co,1062,Eloisa Le Couteur,Looking for fresh buyers? Get hundreds of keyword targeted visitors delivered directly to your site. Boost your profits quick. You'll see results in as little as 24 hours. For more info For details visit: http:  www.niche-targeted-web-traffic.xyz,0,0,0,0
andmorefine/since-co,1061,Lynette Morgans,"Your All In One Solution For Creating All The Content You'll Ever Need.

Proprietary AI Turns YouTube Videos Into Traffic Getting Articles At The Press Of A Button!

We’ve Been Getting Free Autopilot Traffic From Google Without SEO Experience For Over 2 Years By Converting Others YouTube Videos Into Articles…

https:  warriorplus.com o2 a gmvfs 0",0,0,0,0
andmorefine/since-co,1060,Eric Jones,"Cool website!

My name’s Eric, and I just found your site - andmorefine.com - while surfing the net. You showed up at the top of the search results, so I checked you out. Looks like what you’re doing is pretty cool.
 
But if you don’t mind me asking – after someone like me stumbles across andmorefine.com, what usually happens?

Is your site generating leads for your business? 
 
I’m guessing some, but I also bet you’d like more… studies show that 7 out 10 who land on a site wind up leaving without a trace.

Not good.

Here’s a thought – what if there was an easy way for every visitor to “raise their hand” to get a phone call from you INSTANTLY… the second they hit your site and said, “call me now.”

You can –
  
Talk With Web Visitor is a software widget that’s works on your site, ready to capture any visitor’s Name, Email address and Phone Number.  It lets you know IMMEDIATELY – so that you can talk to that lead while they’re literally looking over your site.

CLICK HERE http:  talkwithcustomer.com to try out a Live Demo with Talk With Web Visitor now to see exactly how it works.

Time is money when it comes to connecting with leads – the difference between contacting someone within 5 minutes versus 30 minutes later can be huge – like 100 times better!

That’s why we built out our new SMS Text With Lead feature… because once you’ve captured the visitor’s phone number, you can automatically start a text message (SMS) conversation.
  
Think about the possibilities – even if you don’t close a deal then and there, you can follow up with text messages for new offers, content links, even just “how you doing?” notes to build a relationship.

Wouldn’t that be cool?

CLICK HERE http:  talkwithcustomer.com to discover what Talk With Web Visitor can do for your business.

You could be converting up to 100X more leads today!
Eric

PS: Talk With Web Visitor offers a FREE 14 days trial – and it even includes International Long Distance Calling. 
You have customers waiting to talk with you right now… don’t keep them waiting. 
CLICK HERE http:  talkwithcustomer.com to try Talk With Web Visitor now.

If you'd like to unsubscribe click here http:  talkwithcustomer.com unsubscribe.aspx?d=andmorefine.com
",0,0,0,0
andmorefine/since-co,1059,Aleisha Flowers,"Hello,

BestLocalData.com has a special package you get any group of databases 
for $49 or $249 for all 16 databases and unlimited emails for a 
year(Domain, IP, Dashboard included).

You can purchase it on BestLocalData.com and see samples if you are 
interested.",0,0,0,0
andmorefine/since-co,1058,Alan Shaw,"Hello,
I hope life is treating you kind!

Are you looking for working capital to further grow and expand your business?

If so, put the power of a direct lender to work for you.

We provide loans up to 500k without requiring good credit or collateral. This is because we base our funding decisions off your 
total monthly bank deposits, and we approve over 95% of all businesses!

Plus, we provide you a funding decision within 30 seconds without submitting a single document, and funding the very next day.

Visit www.fundmybiz.xyz to see how much you qualify for! Applying does NOT affect your credit!

Also, please check out this video to see all the funding options we have available for you.  www.fundmybiz.xyz video

Thanks again and we look forward to funding you soon. 



Warm Regards,

Alan Shaw
Fund My Biz
www.fundmybiz.xyz
",0,0,0,0
andmorefine/since-co,1057,お問い合わせ | andmorefine,"Hey 

CAREDOGBEST™ - Personalized Dog Harness. All sizes from XS to XXL.  Easy ON OFF in just 2 seconds.  LIFETIME WARRANTY.

Click here: caredogbest.online

All the best, 

Bessie
お問い合わせ | andmorefine",0,0,0,0
andmorefine/since-co,1056,Robert Garcia,"Hello,
I hope you’re well and Business is Great!

However, if the lack of working capital is holding your business back, here
are a few things to consider.
 
Don’t let things like bad credit or short time in business keep you from getting the funds you need.

Biz Capital Lenders is a direct lender who can approve your loan today and fund you tomorrow.

Just click on the link to INSTANTLY see how much you qualify for www.directbizfunding.xyz

Warm Regards,

Robert Garcia
Direct Biz Funding
www.directbizfunding.xyz",0,0,0,0
andmorefine/since-co,1055,Ewan Archdall,"Did you know messages that come through on your website contact form can actually be an effective method to get more visitors and sales for your online business? How exactly do we do this? Simple, we craft an ad message like this one for your site and we mass post it to tons of website contact pages on any website and in any business category or area you need. Do ads like these work well? You're living proof that they do since you're reading this message right now What's more, you can do this for less than $3 a day! Want to get more info? just send a quick message here: lefflerg24@gmail.com",0,0,0,0
andmorefine/since-co,1054,お問い合わせ | andmorefine,"EASE YOUR PAIN IN 10 MINUTES EFFORTLESSLY

Be Free from Neck Pain
Try NeckFlexer & Relieve Neck Pain Effortlessly In 10 Min!
Save 50% OFF + FREE Worldwide Shipping

Shop Now: neckflexer.online

Pam",0,0,0,0
andmorefine/since-co,1053,quality monthly SEO plans,"Hi there 
 
I have just analyzed  andmorefine.com for its SEO Trend and saw that your website could use an upgrade. 
 
We will improve your SEO metrics and ranks organically and safely, using only whitehat methods, while providing monthly reports and outstanding support. 
 
Please check our pricelist here, we offer SEO at cheap rates. 
https:  www.hilkom-digital.de cheap-seo-packages  
 
Start improving your sales and leads with us, today! 
 
regards 
Mike MacAdam
 
Hilkom Digital Team 
support@hilkom-digital.de",0,0,0,0
andmorefine/since-co,1052,お問い合わせ | andmorefine,"Hi there 

The complete selection of all Ray-Ban sunglasses styles available online and only 19.99 dollars. 

Insanely special offer for the next 24 hours only! Get yours here: designerframes.online

You Won't Want To Miss This!

Thanks and Best Regards, 

Epifania
お問い合わせ | andmorefine",0,0,0,0
andmorefine/since-co,1051,We get you on the 1rst page of Google or don’t pay,"Hi, are you still in charge of andmorefine.com ? 
 
If you take 30 sec to read this email, we could help you 2X-5X your business. 
 
Most SEO companies will ask you to pay upfront with no guarantee that your website will rank on Google. 
 
We are different ... 
 
Our company specializes in Pay Per Performance SEO. Which means – 
We get your business on the first page of Google before we get paid for our service. 
 
I know that’s a bold statement but we can back it up with 9 years of success in this industry. 
 
If you’re interested in getting on the first page of Google, and only pay if you get there, 
let me know when is a good time for a call. 
 
Get full details here or send us a message to mcmarketing360@hotmail.com: 
https:  getmoreclientsfaster.com performance-based-seo ",0,0,0,0
andmorefine/since-co,1050,お問い合わせ | andmorefine,"Good Morning

Buy face mask to protect your loved ones from the deadly CoronaVirus.  We wholesale N95 Masks and Surgical Masks for both adult and kids.  The prices begin at $0.19 each.  If interested, please check our site: pharmacyoutlets.online

Enjoy,

お問い合わせ | andmorefine",0,0,0,0
andmorefine/since-co,1049,Local SEO for more business,"Hi 
 
I have just took a look on your SEO for  andmorefine.com for the Local ranking keywords and seen that your website could use a push. 
 
We will enhance your Local Ranks organically and safely, using only whitehat methods, while providing Google maps and website offsite work at the same time. 
 
Please check our plans here, we offer SEO at cheap rates. 
https:  speed-seo.net product local-seo-package  
 
Start improving your local visibility with us, today! 
 
regards 
Mike Vance
 
Speed SEO Digital Agency 
support@speed-seo.net",0,0,0,0
andmorefine/since-co,1048,Eric Jones,"Cool website!

My name’s Eric, and I just found your site - andmorefine.com - while surfing the net. You showed up at the top of the search results, so I checked you out. Looks like what you’re doing is pretty cool.
 
But if you don’t mind me asking – after someone like me stumbles across andmorefine.com, what usually happens?

Is your site generating leads for your business? 
 
I’m guessing some, but I also bet you’d like more… studies show that 7 out 10 who land on a site wind up leaving without a trace.

Not good.

Here’s a thought – what if there was an easy way for every visitor to “raise their hand” to get a phone call from you INSTANTLY… the second they hit your site and said, “call me now.”

You can –
  
Talk With Web Visitor is a software widget that’s works on your site, ready to capture any visitor’s Name, Email address and Phone Number.  It lets you know IMMEDIATELY – so that you can talk to that lead while they’re literally looking over your site.

CLICK HERE http:  talkwithcustomer.com to try out a Live Demo with Talk With Web Visitor now to see exactly how it works.

Time is money when it comes to connecting with leads – the difference between contacting someone within 5 minutes versus 30 minutes later can be huge – like 100 times better!

That’s why we built out our new SMS Text With Lead feature… because once you’ve captured the visitor’s phone number, you can automatically start a text message (SMS) conversation.
  
Think about the possibilities – even if you don’t close a deal then and there, you can follow up with text messages for new offers, content links, even just “how you doing?” notes to build a relationship.

Wouldn’t that be cool?

CLICK HERE http:  talkwithcustomer.com to discover what Talk With Web Visitor can do for your business.

You could be converting up to 100X more leads today!
Eric

PS: Talk With Web Visitor offers a FREE 14 days trial – and it even includes International Long Distance Calling. 
You have customers waiting to talk with you right now… don’t keep them waiting. 
CLICK HERE http:  talkwithcustomer.com to try Talk With Web Visitor now.

If you'd like to unsubscribe click here http:  talkwithcustomer.com unsubscribe.aspx?d=andmorefine.com
",0,0,0,0
andmorefine/since-co,1047,Eric Jones,"Hey there, I just found your site, quick question…

My name’s Eric, I found andmorefine.com after doing a quick search – you showed up near the top of the rankings, so whatever you’re doing for SEO, looks like it’s working well.

So here’s my question – what happens AFTER someone lands on your site?  Anything?

Research tells us at least 70% of the people who find your site, after a quick once-over, they disappear… forever.

That means that all the work and effort you put into getting them to show up, goes down the tubes.

Why would you want all that good work – and the great site you’ve built – go to waste?

Because the odds are they’ll just skip over calling or even grabbing their phone, leaving you high and dry.

But here’s a thought… what if you could make it super-simple for someone to raise their hand, say, “okay, let’s talk” without requiring them to even pull their cell phone from their pocket?
  
You can – thanks to revolutionary new software that can literally make that first call happen NOW.

Talk With Web Visitor is a software widget that sits on your site, ready and waiting to capture any visitor’s Name, Email address and Phone Number.  It lets you know IMMEDIATELY – so that you can talk to that lead while they’re still there at your site.
  
You know, strike when the iron’s hot!

CLICK HERE https:  talkwithwebvisitors.com to try out a Live Demo with Talk With Web Visitor now to see exactly how it works.

When targeting leads, you HAVE to act fast – the difference between contacting someone within 5 minutes versus 30 minutes later is huge – like 100 times better!

That’s why you should check out our new SMS Text With Lead feature as well… once you’ve captured the phone number of the website visitor, you can automatically kick off a text message (SMS) conversation with them. 
 
Imagine how powerful this could be – even if they don’t take you up on your offer immediately, you can stay in touch with them using text messages to make new offers, provide links to great content, and build your credibility.

Just this alone could be a game changer to make your website even more effective.

Strike when  the iron’s hot!

CLICK HERE https:  talkwithwebvisitors.com to learn more about everything Talk With Web Visitor can do for your business – you’ll be amazed.

Thanks and keep up the great work!

Eric
PS: Talk With Web Visitor offers a FREE 14 days trial – you could be converting up to 100x more leads immediately!   
It even includes International Long Distance Calling. 
Stop wasting money chasing eyeballs that don’t turn into paying customers. 
CLICK HERE https:  talkwithwebvisitors.com to try Talk With Web Visitor now.

If you'd like to unsubscribe click here http:  talkwithwebvisitors.com unsubscribe.aspx?d=andmorefine.com
",0,0,0,0
andmorefine/since-co,1046,Eric King,"Hello,
I hope life is treating you kind!

Are you looking for working capital to further grow and expand your business?

If so, put the power of a direct lender to work for you.

We provide loans up to 500k without requiring good credit or collateral. This is because we base our funding decisions off your 
total monthly bank deposits, and we approve over 95% of all businesses!

Plus, we provide you a funding decision within 30 seconds without submitting a single document, and funding the very next day.

Visit www.bizfunding4you.xyz to see how much you qualify for! Applying does NOT affect your credit!

Also, please check out this video to see all the funding options we have available for you.  www.bizfunding4you.xyz video

Thanks again and we look forward to funding you soon. 

Warm Regards,

Eric King
Biz Funding 4 You
www.bizfunding4you.xyz

",0,0,0,0
andmorefine/since-co,1045,Concerning andmorefine.com,"The #1 Best Dog Bed Of 2021
Get yours now, we're currently having a sale & Free Shipping
Shop now: dogloverclub.store

お問い合わせ | andmorefine",0,0,0,0
andmorefine/since-co,1044,RE: your website,"Hi,

I came across your website and thought our services may be of interest to you.

Your website can receive 5,000 to 10,000 visitors in just one week.
These are people who are interested in seeing what you have to offer. 
(visits are national - not by city or state).

People will come from online publications in YOUR CATEGORY via popups of your website.
Our service is like no other.

For more info please go to to https:  traffic-stampede.com

We look forward to serving your advertising needs.

Best,
Deb
TS",0,0,0,0
andmorefine/since-co,1043,Bump elliptic from 6.4.1 to 6.5.4,"Bumps [elliptic](https:  github.com indutny elliptic) from 6.4.1 to 6.5.4.
<details>
<summary>Commits< summary>
<ul>
<li><a href=""https:  github.com indutny elliptic commit 43ac7f230069bd1575e1e4a58394a512303ba803""><code>43ac7f2< code>< a> 6.5.4< li>
<li><a href=""https:  github.com indutny elliptic commit f4bc72be11b0a508fb790f445c43534307c9255b""><code>f4bc72b< code>< a> package: bump deps< li>
<li><a href=""https:  github.com indutny elliptic commit 441b7428b0e8f6636c42118ad2aaa186d3c34c3f""><code>441b742< code>< a> ec: validate that a point before deriving keys< li>
<li><a href=""https:  github.com indutny elliptic commit e71b2d9359c5fe9437fbf46f1f05096de447de57""><code>e71b2d9< code>< a> lib: relint using eslint< li>
<li><a href=""https:  github.com indutny elliptic commit 8421a01aa3ff789c79f91eaf8845558a7be2b9fa""><code>8421a01< code>< a> build(deps): bump elliptic from 6.4.1 to 6.5.3 (<a href=""https:  github-redirect.dependabot.com indutny elliptic issues 231"">#231< a>)< li>
<li><a href=""https:  github.com indutny elliptic commit 8647803dc3d90506aa03021737f7b061ba959ae1""><code>8647803< code>< a> 6.5.3< li>
<li><a href=""https:  github.com indutny elliptic commit 856fe4d99fe7b6200556e6400b3bf585b1721bec""><code>856fe4d< code>< a> signature: prevent malleability and overflows< li>
<li><a href=""https:  github.com indutny elliptic commit 60489415e545efdfd3010ae74b9726facbf08ca8""><code>6048941< code>< a> 6.5.2< li>
<li><a href=""https:  github.com indutny elliptic commit 9984964457c9f8a63b91b01ea103260417eca237""><code>9984964< code>< a> package: bump dependencies< li>
<li><a href=""https:  github.com indutny elliptic commit ec735edde187a43693197f6fa3667ceade751a3a""><code>ec735ed< code>< a> utils: leak less information in <code>getNAF()< code>< li>
<li>Additional commits viewable in <a href=""https:  github.com indutny elliptic compare v6.4.1...v6.5.4"">compare view< a>< li>
< ul>
< details>
<br  >


[![Dependabot compatibility score](https:  dependabot-badges.githubapp.com badges compatibility_score?dependency-name=elliptic&package-manager=npm_and_yarn&previous-version=6.4.1&new-version=6.5.4)](https:  docs.github.com en github managing-security-vulnerabilities about-dependabot-security-updates#about-compatibility-scores)

Dependabot will resolve any conflicts with this PR as long as you don't alter it yourself. You can also trigger a rebase manually by commenting `@dependabot rebase`.

[  ]: # (dependabot-automerge-start)
[  ]: # (dependabot-automerge-end)

---

<details>
<summary>Dependabot commands and options< summary>
<br  >

You can trigger Dependabot actions by commenting on this PR:
- `@dependabot rebase` will rebase this PR
- `@dependabot recreate` will recreate this PR, overwriting any edits that have been made to it
- `@dependabot merge` will merge this PR after your CI passes on it
- `@dependabot squash and merge` will squash and merge this PR after your CI passes on it
- `@dependabot cancel merge` will cancel a previously requested merge and block automerging
- `@dependabot reopen` will reopen this PR if it is closed
- `@dependabot close` will close this PR and stop Dependabot recreating it. You can achieve the same result by closing it manually
- `@dependabot ignore this major version` will close this PR and stop Dependabot creating any more for this major version (unless you reopen the PR or upgrade to it yourself)
- `@dependabot ignore this minor version` will close this PR and stop Dependabot creating any more for this minor version (unless you reopen the PR or upgrade to it yourself)
- `@dependabot ignore this dependency` will close this PR and stop Dependabot creating any more for this dependency (unless you reopen the PR or upgrade to it yourself)
- `@dependabot use these labels` will set the current labels as the default for future PRs for this repo and language
- `@dependabot use these reviewers` will set the current reviewers as the default for future PRs for this repo and language
- `@dependabot use these assignees` will set the current assignees as the default for future PRs for this repo and language
- `@dependabot use this milestone` will set the current milestone as the default for future PRs for this repo and language

You can disable automated security fix PRs for this repo from the [Security Alerts page](https:  github.com andmorefine since-co network alerts).

< details>",0,0,0,0
andmorefine/since-co,1042,Raphael Deniehy,"Hey andmorefine.com,
Are you aware of the brand new enemy that is lurking on the horizon these days? If you‘re such a person that spent at least 3 hours on your computer or other devices every day, you ‘ill likely suffer neck pain.
Some pains are good to ignore at once.
But is the neck-pain a concern?
Yes, it is.
It should be a serious concern for you to never ignore. Of course, it may lead to severe complexities if not dealt with earlier. 
The major cause of the pain in the neck!
Poor posture... oh, GOD!
Unfortunately, that is the primary cause of the neck pain of this time.
Sitting uneven on a chair for long hours or sleeping not in a good position may quickly lead you towards severe neck pain.
What Should You Do? Seek a solution.
Interestingly, you can handle neck pain problems with a simple solution.     
Get a neck-massage smart device that is adjustable, and you can use it anywhere you go.
See it here: neckbc.com . It is currently sold at a 50% discounted price even at its affordable price. 
Do NOT take neck-pain a light-weighted sort of pain. Your spine cord may be involved.",0,0,0,0
