Repo,Issue-no,Issue-title,Issue-body,Issue-reaction-total-count,Issue-reaction-plus-one,Issue-reaction-minus-one,Issue-comments
andmorefine/since-co,1367,Judjfefehgje hfejfwhfjkfvjegj jefkkfejfej kfejkfekgrkhrkkgrj,andmorefine.com teyiuwoiwfheujsmdcshflisjdalfjedbfsjhsgdhwyfeudjnfwhdgjkfbefjhdwsfjvnskhfbsjfnvshfbasnjkfbdjvgbfgjkd,0,0,0,0
andmorefine/since-co,1366,Mailing via the feedback form.,"Hi!  andmorefine.com 
 
We put up of the sale 
 
Sending your business proposition through the feedback form which can be found on the sites in the contact partition. Contact form are filled in by our software and the captcha is solved. The profit of this method is that messages sent through feedback forms are whitelisted. This technique increases the probability that your message will be read. 
 
Our database contains more than 27 million sites around the world to which we can send your message. 
 
The cost of one million messages 49 USD 
 
FREE TEST mailing Up to 50,000 messages. 
 
 
This offer is created automatically.  Use our contacts for communication. 
 
Contact us. 
Telegram - @FeedbackMessages 
Skype  live:contactform_18 
WhatsApp - +375259112693 
We only use chat.",0,0,0,0
andmorefine/since-co,1365,title,body,0,0,0,0
andmorefine/since-co,1364,Travis Berti,"Hello,

Need fast cash for your business without all the red tape?

Get an instant approval in less than 30 seconds without pulling your credit
by clicking on this link www.leadingcapital.xyz

If you accept our offer we will fund you the next day.

Applying does NOT affect your credit and NO collateral or personal
guarantees are required.

Also, please check out this video to see all the funding options we have
available for you. www.leadingcapital.xyz video



Warm Regards,

Travis Berti
Leading Capital
www.leadingcapital.xyz







This is an Advertisement.
To unsubscribe, click here www.leadingcapital.xyz unsubscribe

or write to:

Leading Capital
9169 W State St #3242
Garden City, ID 83714




",0,0,0,0
andmorefine/since-co,1363,Kate Gibson,"Hi,

We are Having a Friendship Day Sale!

Would you like thousands people coming to your site
that are interested in what you have to offer? 

People from across the USA will come to you from online publications in your exact category.
This makes for amazing targeting of who arive to your site.

One Day Sale: 5,000 + 1,000 free interested people in 7 days for $54.95.
(visitors are national not by city or state)
Larger packages available.

Happy Friendship Day!

Kind regards,
Kate G.
https:  traffic-stampede.com
Since 2005
",0,0,0,0
andmorefine/since-co,1362,Eric Jones,"Hey there, I just found your site, quick question…

My name’s Eric, I found andmorefine.com after doing a quick search – you showed up near the top of the rankings, so whatever you’re doing for SEO, looks like it’s working well.

So here’s my question – what happens AFTER someone lands on your site?  Anything?

Research tells us at least 70% of the people who find your site, after a quick once-over, they disappear… forever.

That means that all the work and effort you put into getting them to show up, goes down the tubes.

Why would you want all that good work – and the great site you’ve built – go to waste?

Because the odds are they’ll just skip over calling or even grabbing their phone, leaving you high and dry.

But here’s a thought… what if you could make it super-simple for someone to raise their hand, say, “okay, let’s talk” without requiring them to even pull their cell phone from their pocket?
  
You can – thanks to revolutionary new software that can literally make that first call happen NOW.

Talk With Web Visitor is a software widget that sits on your site, ready and waiting to capture any visitor’s Name, Email address and Phone Number.  It lets you know IMMEDIATELY – so that you can talk to that lead while they’re still there at your site.
  
You know, strike when the iron’s hot!

CLICK HERE http:  talkwithcustomer.com to try out a Live Demo with Talk With Web Visitor now to see exactly how it works.

When targeting leads, you HAVE to act fast – the difference between contacting someone within 5 minutes versus 30 minutes later is huge – like 100 times better!

That’s why you should check out our new SMS Text With Lead feature as well… once you’ve captured the phone number of the website visitor, you can automatically kick off a text message (SMS) conversation with them. 
 
Imagine how powerful this could be – even if they don’t take you up on your offer immediately, you can stay in touch with them using text messages to make new offers, provide links to great content, and build your credibility.

Just this alone could be a game changer to make your website even more effective.

Strike when  the iron’s hot!

CLICK HERE http:  talkwithcustomer.com to learn more about everything Talk With Web Visitor can do for your business – you’ll be amazed.

Thanks and keep up the great work!

Eric
PS: Talk With Web Visitor offers a FREE 14 days trial – you could be converting up to 100x more leads immediately!   
It even includes International Long Distance Calling. 
Stop wasting money chasing eyeballs that don’t turn into paying customers. 
CLICK HERE http:  talkwithcustomer.com to try Talk With Web Visitor now.

If you'd like to unsubscribe click here http:  talkwithcustomer.com unsubscribe.aspx?d=andmorefine.com
",0,0,0,0
andmorefine/since-co,1361,Free deep throat porn for you!,"Free deep throat porn for you! --> http:  trueweightloss.iceiy.com 
<a href=""http:  trueweightloss.iceiy.com ?s1=xrymer&lol=1"">Free porn < a> <a href=http:  trueweightloss.iceiy.com ?s1=xrymer&lol=1>Detail < a>:  <a href=http:  trueweightloss.iceiy.com ?s1=xrymer&lol=1>Free porn < a>",0,0,0,0
andmorefine/since-co,1360,Olive Greenlee,"World's Best Neck Massager Get it Now 50% OFF + Free Shipping!

Wellness Enthusiasts! There has never been a better time to take care of your neck pain! 

Our clinical-grade TENS technology will ensure you have neck relief in as little as 20 minutes.

Get Yours: hineck.online

Best,

Olive
お問い合わせ | andmorefine",0,0,0,0
andmorefine/since-co,1359,Get more dofollow backlinks for andmorefine.com,"Hello 
 
We all know the importance that dofollow link have on any website`s ranks. 
Having most of your linkbase filled with nofollow ones is of no good for your ranks and SEO metrics. 
 
Buy quality dofollow links from us, that will impact your ranks in a positive way 
https:  www.digital-x-press.com product 150-dofollow-backlinks  
 
Best regards 
Mike Clapton
 
support@digital-x-press.com",0,0,0,0
andmorefine/since-co,1358,Increase sales for andmorefine.com,"Hi there 
 
Do you want a quick boost in ranks and sales for your andmorefine.com website? 
Having a high DA score, always helps 
 
Get your andmorefine.com to have a DA between 50 to 60 points in Moz with us today and reap the benefits of such a great feat. 
 
See our offers here: 
https:  www.monkeydigital.co product moz-da50-seo-plan  
 
NEW: 
https:  www.monkeydigital.co product ahrefs-dr60  
 
 
thank you 
Mike Nelson
 
support@monkeydigital.co",0,0,0,0
andmorefine/since-co,1357,Posting positive reviews,"Hello, 
 
Our company, RatingsKing, specializes in posting 5-star testimonials on all major review sites. This way people can find you much easier and get a good impression of your business. 
Just go on our website and choose the package that best fits your needs at https:  ratingsking.com packages.php 
 
Our packages start from $49 month. 
Depending on your package you will have a number of positive reviews that we will do for you. You will have reports monthly with the work that has been done in your account. 
 
Usually, we are posting on all major reviews sites or other listings you may have.",0,0,0,0
andmorefine/since-co,1356,Eric Jones,"Hey there, I just found your site, quick question…

My name’s Eric, I found andmorefine.com after doing a quick search – you showed up near the top of the rankings, so whatever you’re doing for SEO, looks like it’s working well.

So here’s my question – what happens AFTER someone lands on your site?  Anything?

Research tells us at least 70% of the people who find your site, after a quick once-over, they disappear… forever.

That means that all the work and effort you put into getting them to show up, goes down the tubes.

Why would you want all that good work – and the great site you’ve built – go to waste?

Because the odds are they’ll just skip over calling or even grabbing their phone, leaving you high and dry.

But here’s a thought… what if you could make it super-simple for someone to raise their hand, say, “okay, let’s talk” without requiring them to even pull their cell phone from their pocket?
  
You can – thanks to revolutionary new software that can literally make that first call happen NOW.

Talk With Web Visitor is a software widget that sits on your site, ready and waiting to capture any visitor’s Name, Email address and Phone Number.  It lets you know IMMEDIATELY – so that you can talk to that lead while they’re still there at your site.
  
You know, strike when the iron’s hot!

CLICK HERE http:  talkwithcustomer.com to try out a Live Demo with Talk With Web Visitor now to see exactly how it works.

When targeting leads, you HAVE to act fast – the difference between contacting someone within 5 minutes versus 30 minutes later is huge – like 100 times better!

That’s why you should check out our new SMS Text With Lead feature as well… once you’ve captured the phone number of the website visitor, you can automatically kick off a text message (SMS) conversation with them. 
 
Imagine how powerful this could be – even if they don’t take you up on your offer immediately, you can stay in touch with them using text messages to make new offers, provide links to great content, and build your credibility.

Just this alone could be a game changer to make your website even more effective.

Strike when  the iron’s hot!

CLICK HERE http:  talkwithcustomer.com to learn more about everything Talk With Web Visitor can do for your business – you’ll be amazed.

Thanks and keep up the great work!

Eric
PS: Talk With Web Visitor offers a FREE 14 days trial – you could be converting up to 100x more leads immediately!   
It even includes International Long Distance Calling. 
Stop wasting money chasing eyeballs that don’t turn into paying customers. 
CLICK HERE http:  talkwithcustomer.com to try Talk With Web Visitor now.

If you'd like to unsubscribe click here http:  talkwithcustomer.com unsubscribe.aspx?d=andmorefine.com
",0,0,0,0
andmorefine/since-co,1355,Eric Jones,"Hey, my name’s Eric and for just a second, imagine this…

- Someone does a search and winds up at andmorefine.com.

- They hang out for a minute to check it out.  “I’m interested… but… maybe…”

- And then they hit the back button and check out the other search results instead. 

- Bottom line – you got an eyeball, but nothing else to show for it.

- There they go.

This isn’t really your fault – it happens a LOT – studies show 7 out of 10 visitors to any site disappear without leaving a trace.

But you CAN fix that.

Talk With Web Visitor is a software widget that’s works on your site, ready to capture any visitor’s Name, Email address and Phone Number.  It lets you know right then and there – enabling you to call that lead while they’re literally looking over your site.

CLICK HERE https:  talkwithwebvisitors.com to try out a Live Demo with Talk With Web Visitor now to see exactly how it works.

Time is money when it comes to connecting with leads – the difference between contacting someone within 5 minutes versus 30 minutes later can be huge – like 100 times better!

Plus, now that you have their phone number, with our new SMS Text With Lead feature you can automatically start a text (SMS) conversation… so even if you don’t close a deal then, you can follow up with text messages for new offers, content links, even just “how you doing?” notes to build a relationship.

Strong stuff.

CLICK HERE https:  talkwithwebvisitors.com to discover what Talk With Web Visitor can do for your business.

You could be converting up to 100X more leads today!

Eric
PS: Talk With Web Visitor offers a FREE 14 days trial – and it even includes International Long Distance Calling. 
You have customers waiting to talk with you right now… don’t keep them waiting. 
CLICK HERE https:  talkwithwebvisitors.com to try Talk With Web Visitor now.

If you'd like to unsubscribe click here http:  talkwithwebvisitors.com unsubscribe.aspx?d=andmorefine.com
",0,0,0,0
andmorefine/since-co,1354,Jag fick en ny Porsche Cayenne Turbo S pa 17 dagar,"For tre dagar sedan tog jag min nya Porsche Cayenne Turbo S fran en bilhandlare. 
Jag kopte ocksa ett hus for 1 750 000 euro, fordelade alla mina skulder och slutade jobba. 
Jag tjanade 7 350 938 EUR pa bara 89 dagar pa den har webbplatsen https:  www.google.com url?q=https%3A%2F%2Fvk.cc%2Fc6IueF&sa=D&006=293&usg=AFQjCNGcfsC5yehR_jdJlkas6Es4v5B7VQ 
Vanligen registrera dig inte dar och tjana inte, jag ar glad att titta pa dig fran fonstret i min lyxiga lagenhet varje dag nar du gar till och fran jobbet, berova mig inte detta noje. 
Jag tycker ocksa om att titta fran fonstret pa min nya Porsche nar du gar pa gatorna, kor runt med kollektivtrafik eller i dina billiga bilar. 
Jag visade denna webbplats for alla mina vanner, bekanta och slaktingar https:  www.google.com url?q=https%3A%2F%2Fvk.cc%2Fc6IueF&sa=D&960=150&usg=AFQjCNGcfsC5yehR_jdJlkas6Es4v5B7VQ 
Och de borjade alla tjana mycket och blev ekonomiskt rika manniskor som jag ...",0,0,0,0
andmorefine/since-co,1353,Hermelinda Cosh,"Hello

Be Buzz Free! The Original Mosquito Trap.

60% OFF for the next 24 Hours ONLY + FREE Worldwide Shipping
✔️LED Bionic Wave Technology
✔️Eco-Friendly
✔️15 Day Money-Back Guarantee

Shop Now: mosquitotrap.online

All the best,

Hermelinda
お問い合わせ | andmorefine",0,0,0,0
andmorefine/since-co,1352,Trade Forex & Win Tesla Model 3 - 100 Cars Drawn,"Trade Forex & Win Tesla Model 3 - 100 Cars Drawn 
 
Hello dear subscriber. Now you have every chance to win a new Tesla Model 3 car - https:  www.google.com url?q=https%3A%2F%2Fvk.cc%2Fc6IjTY&sa=D&836=469&usg=AFQjCNFcCi_AW0KZy1-k7bYu2x-9Vy_TAQ 
To participate in the promotion, you need to take three simple steps: 
1. Register on our website - https:  www.google.com url?q=https%3A%2F%2Fvk.cc%2Fc6IueF&sa=D&sntz=1&usg=AFQjCNGcfsC5yehR_jdJlkas6Es4v5B7VQ 
2. In your personal account, make a deposit of at least $ 500 
3. Launch a trading robot (your personal manager will help you) 
4. Now every day until October 31, inclusive, you will need to enter your personal account and see how much the robot has traded. 
The essence of the competition is to whom the trading robot earned the most money. The percentage of successful deals is from 60%, so you will be in the black anyway. The winners will be determined on November 1. 
https:  www.google.com url?q=https%3A%2F%2Fvk.cc%2Fc6IueF&sa=D&sntz=1&usg=AFQjCNGcfsC5yehR_jdJlkas6Es4v5B7VQ 
Hurry up to register and complete all the steps to participate in the competition - the number of participants is growing every day. 
https:  www.google.com url?q=https%3A%2F%2Fvk.cc%2Fc6IueF&sa=D&sntz=1&usg=AFQjCNGcfsC5yehR_jdJlkas6Es4v5B7VQ",0,0,0,0
andmorefine/since-co,1351,Cecil Marron,"EASE YOUR PAIN IN 10 MINUTES EFFORTLESSLY

Be Free from Neck Pain! Try NeckFlexer & Relieve Neck Pain Effortlessly In 10 Min!

Save 50% OFF + FREE Worldwide Shipping

Shop Now: neckflexer.online

Best regards, 

Cecil",0,0,0,0
andmorefine/since-co,1350,Rebecca Edmunds,"Hi,

I thought you may be interested.
 
We are the supplier of best niche ready made dropship stores.
The average markup on all products is 100% to 300%.
Our sites and are 2nd to none and come loaded with hot selling products.

Free hosting permanently, domain and social media marketing plan are all included.
Just a one time payment and thats it. Your only other cost is the yearly renewal of domain.

If this sounds of interest please see our newest available dropship stores today.

Thank you for your time and hope to see you on our site.

Regards,
Rebecca
https:  dropshippingincome.com",0,0,0,0
andmorefine/since-co,1349,Lazaro Alcantar,"Good morning afternoon!
A wonderful day to you!
Subsequent to our previous emails, have you gotten your Hibrew 3-in-1 Espresso Maker? If yes, great! If no, please sit tight and go through this email and see why you wouldn’t want to miss out on this!
Unlike most espresso or coffee makers, Hibrew is a 3-in-1 coffee maker. It’s compatible with Dolce Gusto Capsule, Nespresso capsule, and the regular coffee powder. The idea is to help you save money and time without having to get a specific coffee maker for each of the coffees
It’s environmentally friendly and quite easy to use. Hibrew comes with amazing specifications – 700ml detachable water tank, a One-touch button configuration with two cup capacity options – short and long. 
It also comes with a rapid heating system, which prepares your coffee within seconds. All you need is, fill the water tank, place your capsule or coffee, select the coffee volume you need. Then, allow the machine to do the rest. Unlike other coffee makers that emit 75-80 dB of noise, it only emits 68 dB. 
Also, it delivers up to 19 bar pressure and a 92 degrees’ constant temperature extraction, sufficient to unlock the desired flavor from your capsule and create an incomparable dense coffee crema. To cap it all, Hibrew espresso is built to save energy. It automatically turns itself off after 15 minutes of standby time to save energy. 
This is just the ideal coffee or espresso maker for you. Why don’t you Get Yours Today and save more money? It’s effective, it’s convenient and it’s affordable.  Visit Our Catalogue Today!
Buy Yours Now at thehibrew.com

Warm Regards
TheHibrew.com",0,0,0,0
andmorefine/since-co,1348,It’s time to find a steady girlfriend. A lot of single ladies are waiting here,Wanna casual sex? My pussy is at your disposal! Find my profile with phone number here   >>>>>>>>>>>>>>  https:  www.google.com url?q=https%3A%2F%2Fhot-girls-here.com%2FZsd9gYcd&sa=D&2t=1r&usg=AFQjCNH1cFMpf5xulRS_ME8x6B8wpeKUyw   <<<<<<<<<<<<<,0,0,0,0
andmorefine/since-co,1347,"Invest in altcoins and get 100,000% of your investment. HOT list of altcoins at a low price.","Hello dear subscriber. 
 
Tesla is pleased to recommend you our partners, an independent team of developers - investors who, 
 
through laborious calculations from 1000+ different altcoins, managed to find those coins that will rise by more than 15,000% each in the next 1.5 years, 
 
regardless of the cost of BTC and ETH. 
 
https:  www.google.com url?q=https%3A%2F%2Fvk.cc%2Fc6ynJE&sa=D&6l=t3&usg=AFQjCNH7YFsOzhq0Lg_oGy-WnZdWgXKfKw 
 
If you invest in each of the 18 coins presented in their 
 
list for at least $ 30, then you can earn more than $ 15,000,000 in the next 1.5 years. 
 
https:  www.google.com url?q=https%3A%2F%2Fvk.cc%2Fc6ynJE&sa=D&ck=25&usg=AFQjCNH7YFsOzhq0Lg_oGy-WnZdWgXKfKw 
 
Tesla has already invested a decent amount in each of these altcoins. 
 
Also, the first 50 to buy their hot list are provided with a 50% discount coupon i.e. 
 
the list price (which will make you a multimillionaire) is only $ 2,000. 
 
Tesla will also be grateful to you if you recommend our partners and their product to your friends and acquaintances. 
 
Hurry up to buy a discounted product and invest faster, who knows, maybe tomorrow some of the coins will soar by more than 15,000%. 
 
To get a discount on the product page, click ""Apply Coupon"" and enter it ""CRYPTO2000"" (without quotes). 
 
https:  www.google.com url?q=https%3A%2F%2Fvk.cc%2Fc6ynJE&sa=D&dr=36&usg=AFQjCNH7YFsOzhq0Lg_oGy-WnZdWgXKfKw",0,0,0,0
andmorefine/since-co,1346,Travis Berti,"Hello,

Need fast cash for your business without all the red tape?

Get an instant approval in less than 30 seconds without pulling your credit
by clicking on this link www.leadingcapital.xyz

If you accept our offer we will fund you the next day.

Applying does NOT affect your credit and NO collateral or personal
guarantees are required.

Also, please check out this video to see all the funding options we have
available for you. www.leadingcapital.xyz video



Warm Regards,

Travis Berti
Leading Capital
www.leadingcapital.xyz







This is an Advertisement.
To unsubscribe, click here www.leadingcapital.xyz unsubscribe

or write to:

Leading Capital
9169 W State St #3242
Garden City, ID 83714




",0,0,0,0
andmorefine/since-co,1345,"Apple Offers Passive Income From $ 5,000 A Week To Everyone","Apple has developed the latest AI-based trading robot that makes more than 90% of successful transactions in cryptocurrency trading. 
 
You are guaranteed to receive from $ 5000 per week of passive income while your trading robot is working 24 7. 
 
https:  www.google.com url?q=https%3A%2F%2Fvk.cc%2Fc6jWfc&sa=D&u2=c6&usg=AFQjCNHdwHGe2DxgDiPDujhsvUic-IZkjA 
 
You don't need any skills. 
 
To get started, you need to take the following steps: 
 
1. Register on the website of our trading robot https:  www.google.com url?q=https%3A%2F%2Fvk.cc%2Fc6jWfc&sa=D&jo=rj&usg=AFQjCNHdwHGe2DxgDiPDujhsvUic-IZkjA 
 
2. Top up the balance in your personal account for at least $ 500 
 
3. Launch a trading robot 
 
4. Watch how your account balance grows 
 
5. Withdraw profit every week 
 
6. Enjoy life",0,0,0,0
andmorefine/since-co,1344,title,body,0,0,0,0
andmorefine/since-co,1343,"Amazon offers everyone a passive income of $ 15,000 per week","Amazon, together with the companies Euronext and Norton, have developed a smart system for generating passive income from the difference between cryptocurrencies, including Bitcoin. 
 
https:  www.google.com url?q=https%3A%2F%2Fvk.cc%2Fc6jWfc&sa=D&33=6t&usg=AFQjCNHdwHGe2DxgDiPDujhsvUic-IZkjA 
 
Now you can also receive passive income from $ 15,000 per week without doing anything and without having any skills. 
 
Act now, register and launch the system and by the end of next week you will have more than $ 25,000 in your account. 
 
https:  www.google.com url?q=https%3A%2F%2Fvk.cc%2Fc6jWfc&sa=D&ar=xa&usg=AFQjCNHdwHGe2DxgDiPDujhsvUic-IZkjA",0,0,0,0
andmorefine/since-co,1342,cheap monthly SEO plans,"Hello 
 
I have just took an in depth look on your  andmorefine.com for its SEO Trend and saw that your website could use a boost. 
 
We will increase your SEO metrics and ranks organically and safely, using only whitehat methods, while providing monthly reports and outstanding support. 
 
Please check our services below, we offer SEO at cheap rates. 
https:  www.hilkom-digital.de cheap-seo-packages  
 
Start increasing your sales and leads with us, today! 
 
regards 
Mike Macey
 
Hilkom Digital Team 
support@hilkom-digital.de",0,0,0,0
andmorefine/since-co,1341,Louise Beacham,"Hey!

Get all the leads you ever need. We have a special offer running BusinessLeads101.com. 

Stop paying Facebook and Linkedin and get a once-off solution.

Regards,
Louise",0,0,0,0
